コンテンツ,動画のタイトル,動画公開時刻,長さ,視聴回数,インプレッション数,インプレッションのクリック率 (%),平均視聴時間
合計,,,,53077,826953,3.87,0:06:26
2qNRO7_5RmQ,初心者が最初につまづく「ルーター」と「スイッチ」の違いを解説,"Apr 22, 2024",1171,4882,61480,5.64,0:05:40
Q6GhUMQpKM8,総額10万円超!! 自宅ネットワークをフル10Gbps化すると実測スピードはどれだけ出るのか!?,"Feb 16, 2026",2707,3399,43054,5.69,0:08:56
dOfOovufttI,現役ネットワークエンジニアがデータセンターについて解説します。,"Feb 20, 2023",1896,3072,58895,3.47,0:06:30
2Cn8ylwRL1U,学べる手段が圧倒的に少ない!? 初心者ネットワークエンジニアの独学の難しさを語る,"Mar 2, 2026",1411,2353,37196,4.06,0:05:09
OEHAw6zuZ_Q,【30分で解説】BGPってなに？【BGPがわかるとインターネットがわかる】,"Mar 21, 2022",1969,2304,30021,4.55,0:10:09
vAKmvVeUAn8,総額10万円以上の自宅10Gbpsネットワークを数ヶ月使ってみた感想,"May 26, 2026",1060,1946,27512,4.95,0:04:08
QkMnhxv5yY8,ネットワークエンジニアを辞めようと思ったことある？【人生相談】,"May 11, 2026",1185,1888,32604,3.77,0:03:45
tZU23UkkUOk,新人エンジニアにオススメしたい「勉強しても損しない技術」の見極め方,"Mar 9, 2026",1307,1481,27211,3.4,0:05:54
cSzv2TTiIKg,光ファイバー&光トランシーバー  初心者向け講演をざっくり解説【JANOG55プログラム解説】,"Jun 16, 2025",1740,1385,14760,6.31,0:06:19
Rarf0iGgyAg,【超入門2023①】ネットワーク業界関係者しか知らない「インターネットの中身」,"Aug 28, 2023",1053,1288,3974,7.1,0:04:11
E9VL1Ot_cfw,「AIによってネットワークエンジニアの仕事は本当に奪われるのか!?」現役エンジニアが真剣に議論してみた,"Mar 16, 2026",1125,1250,20565,4.19,0:05:51
37VDH0fvOCA,個人向けルータ と 企業向けルータ の違いを解説してみました。,"Aug 16, 2021",1744,972,13939,4.9,0:07:01
49dGy5QKn8s,14万人が参加した国内最大級のネットワーク展示イベント Interop Tokyo 2026 を現地レポート,"Jul 13, 2026",3399,860,15327,3.75,0:07:54
fpXltBcfNeY,現役ネットワークエンジニアがインターネットの裏側について語ってみました,"Jan 7, 2020",3550,853,7723,2.68,0:07:38
Df-6ElLx7V0,市販品なのに規格外!? 国内メーカーが語る LANケーブル のトラブル事例【JANOG57プログラム解説】,"Apr 27, 2026",2200,815,12456,3.33,0:08:48
DXywOKGX5aU,実力のあるネットワークエンジニアは、なぜ転職しないのか,"Jun 1, 2026",1351,787,12111,4.69,0:06:48
Kfnd_iA_rm8,衛星インターネット Starlink が爆速な理由 を現役ネットワークエンジニアが解説してみた,"Nov 14, 2022",2998,714,2937,3.71,0:04:04
nebaHUZSPUA,生成AI向けデータセンター 、普通のDCと何が違うの？,"May 18, 2026",1601,660,12002,3.74,0:08:33
mby-5QCJpAU,ネットワーク業界関係者6000名が集まった「JANOG57 in 大阪」 当日の状況を現地から振り返る,"Feb 24, 2026",2963,632,10909,2.89,0:06:55
n20srMkJuPA,KDDI新入社員が作った!! 遊んで学べる ネットワークボードゲームを現地レポート 【JANOG57 BoF】,"Apr 20, 2026",2693,628,8960,3.75,0:03:50
Kgq6-xUBAD8,ネットワーク業界関係者 6000名が集まった JANOG57 in 大阪  に現地参加してきました 【JANOG57前編】,"Apr 6, 2026",1385,623,12671,3.4,0:04:08
rbVrhAaDtHo,現役ネットワークエンジニアが実践している「ストレスとの正しい付き合い方」,"Mar 23, 2026",1738,584,10281,3.72,0:06:30
fJFRSbRJJPA,「ピアリング」 と「IX (インターネットエクスチェンジ) 」について話してみました。【show int x JPIX コラボ企画】,"Jun 14, 2021",1844,553,8259,3.41,0:07:15
0YCilxx9tHI,現役エンジニアが「ネットワークエンジニアとサーバーエンジニアの違い」について話してみました。,"Mar 29, 2021",1602,525,8814,4.16,0:05:38
fLCwanCxniM,JANOG57 in 大阪 に集まるネットワーク業界の企業展示ブースを散策してきました 【JANOG57後編】,"Apr 13, 2026",1288,510,9221,3.34,0:03:51
SNUdTMWOuus,トラフィックで見る 野球世界一決定戦 WBC2026,"Mar 30, 2026",1361,497,8415,2.98,0:05:18
MaKhbTaJAyE,【超入門2023⑤】IX・トランジット を理解するとインターネットの業界構造がみえてくる,"Dec 5, 2023",1189,490,4058,7.66,0:06:33
G_Vhuktg-YI,【超入門2023⑨】DNS 名前解決の仕組みを５分でざっくり解説,"Apr 29, 2024",318,489,3987,7.62,0:02:10
XSIWMsrMOFo,自分のネットワークエンジニアとしての市場価値を知る方法【転職ノウハウ】,"Jul 20, 2026",1454,454,7890,4.02,0:05:06
ruLrwkFUHtc,コンテンツ充実しすぎ!? JANOG58 in 愛媛 松山 の発表タイムテーブルを眺めてみよう【開催直前!! JANOG58 松山 7/15(水)~17(金)】,"Jul 6, 2026",3125,450,8033,3.34,0:08:55
hlGeHJUdGT4,【超入門2023③】日本のISP (インターネットサービスプロバイダ) を一気に解説,"Oct 23, 2023",635,421,3044,6.96,0:04:08
P4JHBQlGK4M,『理想のエンジニア』を採用するには、何をするべきか。何をやってはいけないか。,"Jun 8, 2026",1850,407,8356,2.84,0:07:29
xqTUhtzpGV4,現役ネットワークエンジニアが『インターネットの絵本』を作りたくなった話,"Jun 15, 2026",1273,395,7618,3.32,0:04:22
qMg-YU5AxZI,BGPってどうやって勉強すればいいの？ネットワークプロトコルの効率の良い勉強方法について話してみました。,"Jan 4, 2021",2638,361,5513,4.24,0:08:22
vi7n-dzo38U,知らないと大障害の可能性も！？「NTP（ネットワークタイムプロトコル）」について解説してみました 【show int x セイコーソリューションズ コラボ企画】,"Jun 28, 2021",2228,353,4369,3.55,0:12:08
MO2D9KyV4-4,ネットワークエンジニアはどうやって勉強していけばいいの？学習方法やキャリアの積み方について,"Aug 21, 2020",2323,346,5528,4.4,0:07:07
 -JhkpXgltZ8,【超入門2023②】「インターネットの正体」は無数のネットワークが繋がってできている,"Sep 18, 2023",729,338,2522,7.61,0:05:25
TBEpi0Vp5t4,変化の激しいAIデータセンター最新技術のキャッチアップに苦労している話,"Jun 29, 2026",1990,337,7003,3.13,0:08:44
ujwIY5fcUcc,【18分で解説】セグメントルーティングってなに？【show int 自習室】,"Apr 4, 2022",1116,321,2907,7.12,0:04:41
LyH10vqH6zg,インターネットを構成する「ネットワーク業界マップ」について話してみました。,"Jan 18, 2021",4509,312,3974,4.18,0:16:41
NHdm1Xd2svI,Console Server : Remote Access Device for Routers & Switches,"Aug 22, 2024",359,301,1586,9.14,0:01:40
5Mlsgp8ZmRE,【超入門2023⑧】「ルーティング」の概念がわかると「インターネットのしくみ」がわかる【6分で解説】,"Mar 19, 2024",409,282,2011,8.6,0:02:58
YouQn1-KOnM,元Google ネットワーク戦略交渉担当が語る「世界のインターネットで今起きていること」【エンジニア対談ポッドキャスト powered by セイコーソリューションズ】,"Feb 2, 2026",3089,257,5487,2.15,0:09:10
jMaE0dvmmjY,責任の重いチームリーダーの役割になったときに家族の存在に助けられた話,"May 4, 2026",1389,231,6134,2.35,0:05:48
SX7zeKzT08M,【超入門2023④】クラウド事業者・データセンタ事業者・CDN事業者・コンテンツ事業者の違いを解説,"Nov 20, 2023",890,226,2380,5.63,0:07:01
u602X43oJow,【超入門2023⑥】アクセスネットワーク事業者・海底ケーブルの裏側について解説,"Jan 29, 2024",748,224,2125,4.94,0:05:22
ZeYwGmf_26k,「インターネットの構造」を現役ネットワークエンジニアが解説しました。,"Nov 30, 2020",4325,220,2815,4.3,0:12:35
sDK6la8Xg80,クラウドインフラ利用に向いているWebサービス・向いていないWebサービス,"May 13, 2024",1773,204,3150,3.24,0:07:44
NgtdT7_racI,「インフラエンジニア」と「ネットワークエンジニア」の違いを現役ネットワークエンジニアが解説,"Aug 26, 2024",2034,200,3521,4.03,0:07:02
q5UI2CVmyY8,SD-WANについて専門家に話を聞いてみました。,"Nov 5, 2019",2514,199,2910,4.98,0:04:52
G1latybZrEE,現役エンジニアが実践する在宅ワーク中の効率の良い『休憩時間』の過ごし方,"Jun 22, 2026",1300,196,5015,2.23,0:04:10
jXwMHSTqFJw,現場のネットワークエンジニアが愛用する仮想ネットワーク検証ツール Containerlab を解説,"Feb 17, 2025",1634,195,1899,5.21,0:06:18
G9338nvFDOM,各社のネットワーク構成がわかる「Peering DB」について話してみました,"May 10, 2021",2855,190,3015,3.75,0:11:21
Pm6nPx1_rKE,ネットワークの緊急事態を支える装置 「コンソールサーバー」について解説してみました【実機デモあり】【show int x セイコーソリューションズ コラボ企画】,"Mar 15, 2021",2264,183,1951,4.66,0:10:40
HY68i7aNLGM,現役ネットワークエンジニアがInterop Tokyo2021のShowNetと各社展示ブースをレポートしてみました。,"Apr 19, 2021",2204,182,2309,6.19,0:03:27
SrCsM_qxRhE,シリコンバレー企業の1on1ミーティングを再現してみた,"Dec 20, 2021",1855,173,1633,4.53,0:07:35
vGY0WcRg1oY,とまらないネットワークを作るための仕組み「 冗長化」を解説してみた,"Apr 11, 2022",982,171,1554,6.69,0:04:57
5_FF5TemRdM,【超入門2023⑦】「通信トラフィック」でみるインターネット,"Feb 26, 2024",813,169,1706,5.63,0:06:03
lt-jFA4rwwU,NTTが掲げる次世代構想 IOWN と APN (オールフォトニクス・ネットワーク) をざっくり解説,"May 20, 2024",1457,169,2454,4.48,0:04:13
sNwNY7jkRYw,20種類以上ある!? 100Gbps 光トランシーバー の正しい選び方を解説,"Jul 7, 2025",2891,165,3128,3.52,0:08:13
ssQo608m31o,「EVPNマルチホーミング」から学ぶ ネットワーク機器 冗長化技術 の過去と未来【JANOG52プレゼン解説】,"Oct 30, 2023",1904,152,2079,4.47,0:08:40
vbBJrTkIsYI,ネットワークエンジニア志望の学生/新卒におすすめのIT企業の選び方【就活】,"Jul 17, 2023",1605,150,1316,6.31,0:03:31
wPQCTZ6G5WU,開催直前!! JANOG57 in 大阪 のタイムテーブルを眺めてみよう 【JANOG57予習】【2/11-13開催】,"Feb 9, 2026",3036,146,4340,1.54,0:31:31
0FvRsZFAdUs,ネットワークエンジニアの新たな重要スキル Python について語ってみた,"Feb 13, 2023",1604,145,2708,3.91,0:05:17
OPLcqlxDKUQ,ネットワークエンジニアの給料事情についてぶっちゃけて話してみました。,"May 31, 2021",1350,142,2404,4.45,0:04:06
47BsTFssUR8,Interop Tokyo2023を支える ShowNet 構築の裏側,"Jul 6, 2023",2944,137,1594,6.78,0:08:05
ha__Bl8OUEM,ネットワーク自動化のプログラムをPythonで書いてみた,"Aug 21, 2023",1215,134,1199,6.59,0:04:57
NmkI0ZwXyLc,エンジニア人生で「楽しい仕事」のチャンスを掴み続けるためのテクニック【ノウハウ】,"Jan 19, 2026",1394,126,3446,1.74,0:05:10
8yJnGeNNhZc,ネットワークエンジニアの転職面接でされる質問と対策,"Nov 13, 2023",1820,119,1800,4.28,0:07:17
NU-2aNYGFd4,「踏み台サーバー」ってなに？ 運用失敗あるある事例と最新動向 【show int x セイコーソリューションズ コラボ企画】,"Jan 15, 2024",1926,118,1312,5.26,0:05:46
dTeL-nUMvfE,KDDI が実現に成功した「ホワイトボックス・ルーター」を解説【JANOG52プレゼン解説】,"Sep 25, 2023",2059,117,1079,4.73,0:09:08
SOW6JQWjVjw,「 ネットワークエンジニアはやめとけ」と言わている件について現役ネットワークエンジニアが検証してみた,"Aug 23, 2021",1812,108,2068,2.71,0:04:21
5r2cx1IbsiM,エンジニア面接で面接官が注目しているポイントについて経験者が語ってみた【転職・就活】,"Dec 1, 2025",1482,104,2528,2.33,0:06:59
t3cHXObUn64,ネットワーク機器メーカー 業界マップを作ってみた,"Jan 31, 2022",825,102,1133,5.91,0:02:47
Rw3_WbD3sWk,仮想CPU について現役エンジニアが説明してみた【技術用語解説】,"Nov 24, 2025",1870,97,2546,2.2,0:09:02
2q5wGbpl0kg,朝活してたら、たまたま Nintendo Switch 2 が買えた話。2台。,"Jul 21, 2025",2592,94,892,0.9,0:02:07
Xr31WBxfLis,ネットワーク機器を支える心臓部 ネットワークチップ（汎用シリコン/ASIC）の世界【ネットワークエンジニアの基本知識】,"Dec 16, 2024",2585,92,1420,2.54,0:07:52
5s7Dr9-OoHo,SIer企業の分類と特徴について話してみました,"Nov 8, 2021",1169,92,1307,4.06,0:04:15
j2GVuO4HRPU,【最新技術トレンド】ローカルブレイクアウトってなに？,"May 23, 2022",2068,91,1270,4.49,0:10:13
12gnSyLwErM,「フロー解析ってなんですか？」という疑問に現役ネットワークエンジニアが回答してみた #トラフィック解析 #sflow #netflow #IPFIX,"Oct 27, 2025",2517,87,2309,2.38,0:13:06
EhUuXM54OBg,現役エンジニアが技術調査に活用するAIツール Google NotebookLM,"Nov 10, 2025",2410,86,1995,2.71,0:08:07
UvSrWVLRML4,次世代の公衆Wi-Fi 基盤 OpenRoaming（オープン ローミング） についてざっくり解説 【JANOG53プログラム解説】,"Jun 10, 2024",1438,86,1143,3.67,0:05:44
UveycHYTyNY,詳細解説はNG!? エンジニアが非技術系チームに技術説明する際のアンチパターン【エンジニアノウハウ】,"Jan 12, 2026",1145,84,2570,1.01,0:05:54
sS0pKmqxKjY,最新ネットワークアーキテクチャー CLOSネットワークについて解説します。,"Nov 9, 2020",2642,84,1375,1.89,0:05:07
I4oF8jdg_ks,JANOG48開催直前！ネットワークエンジニアがJANOGに参加したほうがいい５つの理由について話してみました。,"Jul 5, 2021",2641,81,1014,5.23,0:05:55
XuzoGeunmAA,モバイルネットワーク専門家が教える MVNO 超入門 【show int x レンジャーシステムズ コラボ企画】,"Apr 14, 2025",2847,77,1062,3.58,0:10:07
gNXVB1QPD7Q,「インターネットの中の世界」を現役ネットワークエンジニアが解説しました。,"Nov 30, 2020",2466,76,951,4,0:09:00
MRPW9sQjomE,ネットワーク企業がマルチベンダーを採用する理由,"Feb 7, 2022",1062,76,959,4.48,0:06:23
F8yF3htWIgI,ルーターってなに？,"Sep 25, 2020",1323,73,798,3.76,0:06:29
Y-CVCzwd5xU,JANOG56 in 松江の企業展示ブースを歩きまわる【JANOG56 後編】,"Sep 8, 2025",2695,73,2164,2.45,0:06:14
AUoNMKpM6ik,「もし新人ネットワークエンジニアだったら何を学ぶ？」現役エンジニアがまじめに考えてみた,"Nov 1, 2021",1987,72,1025,5.37,0:04:45
_gPo71LPGnM,レイヤー1 (物理層)のプロに話を聞いてみました,"Apr 19, 2020",2471,70,1218,3.86,0:05:46
lXPyYjMJbto,０円でできる仮想ルーターを使ったネットワーク検証環境について話しました。,"Sep 13, 2021",1596,69,1119,4.29,0:05:30
jQrzaRXby_s,最先端技術が生まれる世界の中心地 シリコンバレー に行ってきた,"Jun 24, 2024",1787,69,429,1.4,0:03:35
VU6p1KBxvro,ネットワークエンジニアが外資企業に転職して気づいた日本企業との違い４選,"Mar 3, 2025",2437,69,1153,3.56,0:05:59
FjCNDp4XgnA,モバイルネットワーク専門家が語る「モバイルインターネットの過去・未来・現在」【3G・4G・5G】【ローカル5G】【6G時代は何がくる？】,"Jan 11, 2024",2040,68,822,5.35,0:08:40
WhTu9Sf1wN0,国内最大級イベント Interop Tokyo 2023 に参加してきました,"Jun 26, 2023",1696,68,709,5.36,0:02:52
yNPXhy-Psg0,現役ネットワーク運用エンジニアの1日のスケジュールを大公開,"Feb 24, 2025",1488,63,723,0.69,0:02:28
7gKKISb7Wlg,次世代のネットワークエンジニアに求められるスキルとは?,"Feb 8, 2021",1989,63,1198,3.09,0:07:53
p5MF5HCiNK8,在宅勤務歴5年の現役エンジニアが本音で語るフルリモートワークの苦悩,"Dec 8, 2025",1626,63,2049,1.56,0:08:24
hcJJ8MfwUes,ミスが多い入社３年目の若手エンジニアにおくるアドバイス,"May 1, 2023",1928,62,858,3.38,0:05:07
Kinac_z4UWY,「オンプレ」と「クラウド」をラクにつなぐ閉域接続サービスを解説してみた【show int x アット東京 コラボ企画】,"Aug 25, 2025",1664,61,1275,2.59,0:07:06
45e_mSygdfo,現役ネットワークエンジニアが「通信トラフィック」について話してみました,"Jan 25, 2021",3631,60,1184,3.13,0:14:53
RH6QYVKLCS4,グローバル企業で働くエンジニアが活用する ChatGPT 英会話学習法,"Dec 15, 2025",1543,60,1812,1.21,0:05:13
f4Rb4HIuBJI,「ネットワークエンジニア未経験者歓迎！」は本当に未経験でもOKなのか,"Nov 28, 2022",920,59,1049,3.91,0:03:54
XtTHr-x47oU,国内最大ネットワーク展示イベント Interop Tokyo 2024 に現地参加してきました,"Aug 19, 2024",1756,56,848,4.13,0:02:44
9oG0PzstWmA,30代後半 転職未経験者からの人生相談「人生で一度は転職は経験しておくべきか？」について議論してみた,"Jun 9, 2025",1333,53,888,1.13,0:04:28
5YEBng2U2oY,人事異動・退職時の「業務の引き継ぎ」は、なぜいつも不十分になるのか【エンジニアの仕事術】,"Sep 30, 2024",1312,51,919,2.61,0:06:31
If5wq2eXTNg,部下の「やらされ感」を無くすために上司/リーダーが仕事をお願いするときの要注意ポイント【ノウハウ】【マネジメント】,"Jan 26, 2026",1513,50,2288,1.01,0:07:38
UfYs0YZHYuY,「一人前のネットワークエンジニアになるにはどうしたらいいの？」という質問に現役エンジニアが回答してみました。,"Jun 21, 2021",1476,48,727,3.3,0:06:13
OROymqO1M0M,オープンソースソフトウェアを導入する際の注意点とは【OSS・内製開発・メーカー製品を比較】,"Dec 22, 2025",1303,48,1910,1.1,0:06:09
XCSsqlBMUk0,物理(L1)作業はネットワークの仕事といえるのか、現役ネットワークエンジニアが感じる本当のところを話してみました。,"Sep 21, 2021",1301,48,498,5.02,0:06:26
eTKrch-rGmU,オライリー本を監訳しました！3年間にわたる監訳の裏側をお話します。【ネットワーク自動化とプログラマビリティ】,"Mar 7, 2022",2770,47,657,3.96,0:05:30
OVz-oS20TUs,Ansible x SmartCS のネットワーク自動化ハンズオンの紹介 【show int x セイコーソリューションズ コラボ企画】,"Sep 15, 2025",1751,47,1489,2.28,0:04:43
semsfskyHl8,広島大学で学生さんに向けて講演してきました【講演動画】【広島大学】,"Jun 2, 2025",3683,45,834,3.12,0:08:55
moUiq5xf9Q4,Twitch 韓国からの撤退「韓国のネットワークコストが10倍」である理由,"Dec 11, 2023",2113,45,858,1.86,0:07:31
o4hgbPBw2a0,新人エンジニアにおすすめしたい技術書籍 3選,"Apr 18, 2022",1759,45,526,5.32,0:04:13
cw7LPi5XSj4,ネットワーク自動化ってなんで流行ってるの？,"Sep 19, 2020",2353,44,882,2.95,0:08:31
mx8VcS6xH98,日本のインターネットの中心地「東京 大手町」について語ってみました,"May 17, 2021",537,44,455,4.4,0:02:30
NpeYtWgHrBY,心配事で頭がイッパイッパイになったときの解決法【エンジニアの仕事術】,"Sep 16, 2024",1212,44,559,0.54,0:02:47
_9FbHgNN-QY,東京から広島に地方移住したネットワークエンジニアの話,"May 24, 2021",285,44,600,4.83,0:01:27
ENLn20MVxzo,運動不足のエンジニアに朗報!?  現役エンジニアが「とある運動」にハマっている話【エンジニア雑談】,"Jan 5, 2026",1182,43,2135,1.12,0:04:01
XQPIjZFm9us,人生における「重要な選択」を決断するための考え方,"Apr 15, 2024",1306,42,403,0,0:01:38
9zXv4anFW2A,文系出身でITスキル未経験者がIT企業で活躍するには何を勉強したらいい？,"Nov 17, 2025",1262,42,1656,1.87,0:04:20
AXqZCYRQK1M,「ネットワークエンジニアに向いている人物像」について語ってみました。,"Feb 22, 2021",1423,41,647,4.64,0:05:27
ttTcbbrOl5g,トップエンジニア育成プログラム「IIJアカデミー」を解説 【2期生募集中 10/31締切】,"Oct 11, 2023",1301,41,495,3.03,0:02:14
1A_zqD3asP0,「エンジニアは土日も勉強すべきなのか？」の議論について現役エンジニアが思うこと,"Sep 12, 2022",1971,40,464,3.45,0:04:57
oWOc2uJtryA,ネットワークエンジニアに資格は果たして本当に必要なのか話してみました。,"Aug 30, 2021",1604,40,615,3.41,0:08:07
as9O-zhvU4s,たった１つのコンフィグで全メーカーのネットワーク機器に利用できる OpenConfig の活用事例【JANOG54プログラム紹介】,"Nov 25, 2024",1789,40,809,2.97,0:05:50
MsyDH9ZUero,サイバー攻撃の最新事情！ DRDoS攻撃 / NTP増幅攻撃 を解説してみた。,"Apr 25, 2022",2544,40,670,3.13,0:14:42
iAifWMt9agQ,ネットワーク業界で働くセールスエンジニアの一日のスケジュール,"Jan 20, 2025",2242,38,728,2.61,0:02:10
ri7oa6-sLHs,show int の中の人 ネットワークエンジニアが転職した話,"Jul 1, 2024",988,37,637,3.3,0:03:25
MhBH2Xtbto0,仕事・育児で多忙なエンジニアにおすすめしたいゲームとの付き合い方【エンジニア雑談】,"Dec 29, 2025",1118,37,2152,1.07,0:05:52
Bg1-On1pLe0,ネットワークエンジニアの快適なリモートワーク環境に必要なもの,"May 8, 2023",1653,36,570,5.09,0:01:45
EqLZTM_DR6g,【未来予測】ネットワーク自動化によってネットワークエンジニアの仕事は無くなる？,"Oct 18, 2021",2264,36,787,3.3,0:08:12
8ertJdXKaE8,なぜあなたのおうちのインターネットは遅いのか?,"Sep 19, 2020",2936,35,824,1.94,0:13:46
UOyu-Qo3m78,グローバル企業で働くために求められるエンジニアの英語力レベル,"Oct 7, 2024",1494,35,554,1.26,0:04:15
DYRI4-y0i8Q,現役ネットワークエンジニアが「得意なこと・苦手なこと」をさらけ出してみた,"Apr 22, 2025",2273,35,915,1.53,0:08:07
NotrMF2s8Ls,ネットワーク系セールスエンジニアの 良い点・悪い点 を 業界10年超の現役エンジニアがまとめてみた,"Dec 30, 2024",1680,34,718,2.92,0:06:32
wbMyttCwkXc,【インタビュー】BIGLOBEネットワークアーキテクト南 雄一さん【前編&後編まとめ】,"Mar 14, 2024",4185,34,648,2.31,0:09:51
Wpsygy5zvcs,スキルアップや勉強で挫折しないための方法について話してみました。,"Sep 27, 2021",1603,33,530,3.96,0:07:56
RSkBvJyJXqo,ネットワーク担当者が知っておくべき「ピアリング交渉」のはじめかた【show int x BIGLOBE】,"Mar 25, 2024",1882,33,614,2.44,0:08:38
t1TCyl7Xg-0,最前線で闘うネットワークエンジニア 川上 雄也 さん #標準化 #IETF #RFC #3GPP #AI/ML【エンジニア対談】,"Nov 27, 2023",2229,33,366,1.37,0:03:31
kKFgkEDl82k,「エンジニア」から「マネージャー」になって仕事のやり方が激変した話,"Oct 13, 2025",2071,33,1282,0.94,0:05:22
2StmPESYmYk,AI時代にネットワークエンジニアの仕事はどう変わるのか【未来予測】,"Apr 3, 2023",2709,32,702,2.99,0:04:46
AFN41TGU0Qc,ITエンジニアの職種を企業ごとにざっくり分類してみた,"Apr 17, 2023",1271,32,437,2.29,0:04:34
MlSNV9u6wpo,大規模 ISPでエンジニアとして活躍できる人材とは 【BIGLOBE 南 雄一さんインタビュー 後編】【show int x BIGLOBE】,"Mar 14, 2024",1869,32,425,2.82,0:05:28
BSFEFQkzPKQ,ネットワークインテグレーターのエンジニアの働き方【show int x レンジャーシステムズ】,"Feb 10, 2025",1790,32,800,2.5,0:05:59
z0W2U6jmDT8,ネットワークエンジニアから東京都 都庁に転職した平井 則輔さんと対談してみました。,"Oct 4, 2021",2079,32,523,3.44,0:03:48
EnqjEN_7ngU,フルリモートワークで働く現役エンジニアが地方移住して一年半経って見えてきた実際のところ,"Jan 2, 2023",1868,31,490,3.47,0:04:53
nGdNHyyJrko,現役エンジニアが語る「ベンダーロックイン」の本当のところ,"Aug 10, 2021",1131,31,646,3.41,0:04:39
Lk2Dv3nFHmk,「勉強してくれない若手エンジニア」に悩む上司・先輩は何をするべき？【新人教育】,"Apr 8, 2024",1295,31,661,1.66,0:04:10
zvvUixh33Ic,ネットワーク運用エンジニアの 良い点・悪い点 を 業界10年超の現役エンジニアがまとめてみた,"Dec 23, 2024",1768,31,736,1.77,0:04:29
Yq3dY8MX0Y0,若手にオススメしたいネットワーク業界の定番イベント Internet Week 2025【show int x JPNIC コラボ企画】,"Oct 20, 2025",2149,30,1461,1.57,0:04:12
mJmWOYmjVhY,ネットワークエンジニアの仕事の良いところ悪いところ,"Mar 14, 2022",1762,29,667,1.8,0:05:54
gWa3zPkok-8,eSports ゲーマー向けISP を調べてみたら、実は老舗ISPが運営していた話,"Jul 29, 2024",2143,28,643,1.87,0:04:49
qg9gG83Kg3k,「集中管理 vs 分散管理」ネットワーク技術のトレンドを紐解く【JANOG55プログラム解説】,"Aug 12, 2025",2978,28,972,1.03,0:07:21
