NDjp_flODiI,セイコーソリューションズさんと振り返る show int 企業コラボの裏側,"Jul 12, 2021",2319,27,496,4.84,0:03:50
daK0ZzaVaAQ,BIGLOBEネットワークアーキテクト南 雄一さんに聞く「美しいネットワーク設計とは」【前編】【show int x BIGLOBE】,"Mar 11, 2024",2497,27,530,2.83,0:09:06
YYbmk96gTkY,なぜあなたが作った自動化ツールは誰にも使われないのか,"Sep 4, 2023",1767,27,634,2.37,0:03:36
oS8jHqa1HQw,クラウド時代のネットワークエンジニアの生存戦略,"Sep 26, 2022",1013,26,415,4.58,0:04:14
l4ecxPTU4so,ネットワークエンジニアの一日のルーティンについて話してみました。,"Jan 11, 2021",953,26,573,3.66,0:02:45
QkHoB17jIlw,インターネットの大原則「自律・分散・協調」を解説してみた。,"Mar 28, 2022",955,26,523,2.1,0:04:51
etQpnM6vZj0,「ネットワークエンジニアにとって英語は本当に必要か？」について話してみました。,"Jun 7, 2021",1598,26,412,3.64,0:05:11
 -Ca3LruGU2A,IoT技術、エンジニアのスキルセットについて話してみました。,"Apr 7, 2019",2149,26,609,2.3,0:06:23
K83YRt_jDY4,サイバーエージェントが構築した AI/ML専用インフラのネットワーク要件がヤバすぎた【JANOG52プレゼン解説】,"Oct 16, 2023",1613,26,676,2.22,0:08:59
M4Sdf6GlIoY,自動化に向いているネットワークインフラの共通点とは？,"Feb 15, 2022",1152,25,429,3.03,0:06:19
bpWkGGo5a1Y,時代で変化するインターネットのパワーバランス,"Aug 8, 2022",2075,24,621,2.74,0:10:14
1lLySfl582U,ChatGPT でルーターコンフィグを正しく作れるのか現役ネットワークエンジニアが検証してみた,"Jul 28, 2025",1423,24,923,1.73,0:04:40
AIzrqNrTJu0,若手女性エンジニア 髙木萌さんに聞く「ネットワーク業界に飛び込んだきっかけ」,"Apr 24, 2023",1919,23,442,1.81,0:03:17
T8W4juInmts,ネットワークチップ進化の展開予測 2025年~2026年【インターフェースの高速化・大容量化】,"Feb 3, 2025",2036,23,763,1.7,0:07:21
c-gG8WpT4u0,ネットワークエンジニアってどうやってなるの？就職方法について,"Sep 4, 2020",1328,23,638,3.13,0:04:39
6Wrac0eR0m8,【JANOG51講演動画】ここがヘンだよ日本人の英語コミュニケーション 〜日本人特有の落とし穴を知り、グローバル社会でも活躍できるエンジニアになろう〜,"Mar 6, 2023",3160,23,954,0.52,0:06:47
KnweWgTBFyg,新しい CDN 配信 のしくみ Open Caching (オープン・キャッシング) をざっくり解説【JANOG53プログラム解説】,"Jun 3, 2024",1326,23,691,1.3,0:02:40
kyDEzx8C3C4,失敗しないネットワーク機器の選定のコツとは,"Jan 24, 2022",1246,22,446,3.14,0:07:09
X46yuXxS2OA,転職活動中に絶対にやってはいけない１つのこと【#100日後に退職する47歳】,"Oct 23, 2021",1390,22,370,2.43,0:04:38
FsUT4wX1L8A,ネットワークエンジニアが注目しておくべき最新技術カンファレンス 4選,"Jan 23, 2023",1675,22,463,4.1,0:03:39
rXImv_hm0Nw,目標設定における「KPI」と「OKR」の違いを解説,"Mar 4, 2024",1653,22,402,1.24,0:03:54
QGyoLTqCAoI,ネットワークエンジニアの効率の良い収入の増やし方について話してみました。,"Jul 11, 2022",998,21,393,3.56,0:09:30
qC6lKC8Pqis,ベテラン登壇者が語る「技術プレゼン」を成功させるコツ,"Apr 10, 2023",3540,21,276,2.17,0:04:50
erqpRKLfDG4,外資企業と日本企業の働き方の違いについて比較してみた,"Jul 22, 2024",2238,21,449,0.89,0:04:25
UHsWBL6ZulU,人生初の転職活動を成功させた 神谷 が伝える「エンジニア転職の最新ノウハウ」,"Dec 25, 2023",2363,21,376,1.86,0:06:25
bTwTFVgq-1M,ネットワーク系カンファレンスJANOG48の現地会場の様子と注目すべきプログラムについて紹介してみました。,"Jul 26, 2021",3849,21,441,2.49,0:09:25
U5Aclp1N-i8,エンジニアとしてお給料をたくさん稼いでも幸福度アップに繋がらなかった話,"Nov 11, 2024",1676,21,628,1.75,0:05:31
LJ3e2es0JSg,30〜40歳代の中堅エンジニアの生存戦略,"May 29, 2023",1399,21,665,1.95,0:02:58
y3G37mJ4bmc,旧世代ネットワーク機器へのゼロタッチ・プロビジョニング(初期設定の自動化)を実現しました【デモあり】,"Dec 13, 2021",2334,19,586,1.88,0:05:29
NlKMCnvPtyo,フルリモートワークを実践しているネットワークエンジニアの話,"Nov 15, 2021",1286,19,459,3.27,0:02:57
qVZZEMTV5pk,IT企業に就職したい人は学生時代に何をやっておくべき？ #就活 #就職活動 #新卒 #IT企業 #エンジニア就職 #採用,"Nov 3, 2025",1458,19,1527,0.98,0:07:29
tpoUZJB56WA,新人エンジニアがJANOGスタッフをやるメリットについて話しました。,"Aug 2, 2021",2051,19,489,2.66,0:03:15
qWMwl6M3-_8,API が存在しないレガシー機器をネットワーク自動化する裏ワザ【デモあり】【SmartCS API 活用術】,"Jun 13, 2022",3417,19,528,2.46,0:08:09
yDe4Vue-geI,ネットワーク自動化、テクニカルエバンジェリストについて話してみました。,"Jan 28, 2019",1726,19,360,3.89,0:09:21
pSuDbgYwZVk,2030年のネットワークトラフィックを大予想,"Jun 5, 2023",2832,18,391,2.05,0:01:40
3gTQ1qwfQds,【エンジニア対談】開発エンジニア 中山 真一さんにネットワーク機器の開発の裏側について聞いてみました。【show int x セイコーソリューションズ コラボ企画】,"Apr 12, 2021",2622,18,627,0.64,0:10:42
v9035m7XD2Y,子育てエンジニアの苦悩。自己学習の時間が取れない『焦り』との付き合い方。,"Apr 28, 2025",1343,18,813,1.35,0:07:17
QYGYwPuL1Cs,"ネットワーク自動テストツールBatfish, 技術ブログについて話してみました。","Feb 17, 2019",1312,18,222,2.25,0:04:29
I6IKEMv5XlY,配属ガチャに失敗した新人にオススメしたいキャリア戦略,"Jul 24, 2023",1740,17,339,1.77,0:02:38
UFBzcAL1d2g,ネットワークエンジニアの魅力・楽しいポイントとは？,"Aug 15, 2020",2500,17,708,1.84,0:09:09
TcsWTS5qBzI,ニコニコ超会議2022で実践されたネットワーク自動化事例【セイコーソリューションズ コラボ企画】,"May 22, 2023",847,17,422,2.84,0:02:24
eQBW5bq1jgk,【講演】ネットワーク業界に飛び込んだ若手エンジニア&学生の本音を聞いてみた【NaniwaNOG2】,"Dec 9, 2024",2737,16,712,1.54,0:01:52
1vNz9G6ny-c,現役エンジニアが業務に取り入れているAIチャットツール活用術【ChatGPT】【Google Gemini】,"Sep 23, 2025",2383,16,1069,1.12,0:08:42
un6-rJycTE0,現役エンジニアのフルリモート勤務の悩みを打ち明けてみた,"Mar 17, 2025",1938,15,730,1.23,0:04:24
Z8e5vso5SRU,StackStorm で実現するネットワーク完全自動化の世界,"Oct 24, 2022",2503,15,322,2.17,0:05:45
sh5u0ANvvTs,国内最大のネットワーク業界カンファレンス JANOG56 in 松江 を現地レポート 【JANOG56 前編】,"Sep 1, 2025",1802,15,995,1.11,0:06:48
LnBWaev5MVM,ネットワーク機器メーカーのユーザー会イベントに現地参加してみた 【show int x セイコーソリューションズ コラボ企画】,"May 5, 2025",690,14,687,1.31,0:01:28
ePJIVZZhzRg,エンジニアとして 20代 のうちに身につけておきたい習慣 ３選,"Sep 9, 2024",1963,14,605,1.98,0:05:54
wkayGUiJExY,部下の仕事の「やらされ感」を解消する方法,"Nov 29, 2021",2294,14,263,3.42,0:07:32
lAp_SqplcR4,オフィス回帰ブームでフルリモートワーク継続は困難になりつつある！？,"May 19, 2025",1637,14,810,1.23,0:06:47
wlvjRKOEZxA,show int 神谷が人生初の『転職』に成功しました #外資系 #エンジニア転職,"Dec 18, 2023",1246,13,330,1.52,0:03:09
xdy8xWz9HRA,最先端技術 & おもしろ技術ネタ が盛り沢山の JANOG55 企業展示ブースを現地レポート【JANOG55 後編】,"Apr 1, 2025",2658,13,624,1.76,0:01:49
OssEgB-WuGE,転職経験豊富な現役エンジニアが「失敗しない転職のコツ」について話しました。,"Mar 22, 2021",2407,13,266,2.63,0:07:27
JqYM5B6xqac,時刻同期技術の最前線 IEEE ISPCS2024 参加レポート 【show int x セイコーソリューションズ コラボ企画】,"Jan 13, 2025",3031,13,683,1.17,0:08:44
M1c265IIEWM,エンジニア人生のキャリア設計と目標達成の方法について話してみました。,"Oct 26, 2020",2662,12,482,1.45,0:11:37
m9jyvmtjDH8,【JANOG52長崎 ③】学生&若手エンジニアに聞く「JANOGスタッフをやる理由」,"Aug 14, 2023",2180,12,312,0.96,0:00:17
gOtS3G9WbF8,JANOG49の業界最新トピックを現役ネットワークエンジニアが解説してみた,"Feb 21, 2022",4737,12,497,1.81,0:14:24
vuRD82F0bJM,show int #0 ネットワークエンジニアの雑談 今後やっていきたいこと,"Jan 3, 2019",1940,12,190,3.68,0:07:22
HUUnXzY0_yY,show int をはじめた理由を赤裸々に語ってみた,"Apr 7, 2025",1375,12,708,1.27,0:08:12
YkvU8JmF2qw,アジア各国を飛び回るスターエンジニア maz 松崎 吉伸さん【エンジニア対談】,"Dec 5, 2022",2406,12,174,0.57,0:09:14
ZnV6lEjffcQ,ネットワークエンジニアの職種をざっくり分類してみた,"Jan 17, 2022",1061,12,300,2,0:07:13
e8RPR9N4DNA,部下の悩みを早期解決するために 1on1 で上司が気をつけるべきポイント,"Oct 6, 2025",1825,12,1177,0.25,0:04:00
TBvc9ytiZTw,WhiteBox用ネットワークOS開発の最新動向を聞いてみました,"Feb 22, 2020",1608,12,218,2.75,0:03:34
m2u8w_qVUMk,次の時代のネットワークエンジニアの生存戦略について話してみました。,"Feb 22, 2020",1482,11,339,1.47,0:06:57
oDm-Gj9vU7U,仕事で忙殺される若手エンジニアのためのキャリア戦略術,"May 6, 2024",1316,11,455,1.1,0:10:18
WQr02iyj6n0,現役ネットワークエンジニアが「ネットワーク自動化の歩き方」の記事を執筆しました【n月刊ラムダノート】,"Dec 27, 2021",675,11,256,1.95,0:03:23
emXLPe9YdwE,現役ネットワークエンジニアが教える 新技術導入で気をつけるべきポイント,"Sep 29, 2025",1457,11,1288,0.39,0:04:12
AyPCu89Oq8I,エンジニアが「副業選び」で失敗しないためのコツ,"Sep 23, 2024",2033,11,560,1.61,0:06:28
m48C_XtU1_E,外資企業を経験したエンジニアが考える アメリカ企業・日本企業の企業文化の違い,"Mar 10, 2025",1902,11,627,0.48,0:01:30
 -zfGJIwQUh4,【告知】新人のためのインターネット超入門 3時間講演やります 【6/13(火) 13:00 受付開始】,"Jun 12, 2023",1219,10,333,1.8,0:01:33
2zmJXpfLkhA,【講演】地方移住エンジニアが語る「地方移住者のホンネ」【3SNOG 現地レポート】,"May 13, 2025",3199,10,726,0.83,0:08:45
iQg49y7KSVU,ワールドカップ2022 の裏側でネットワークエンジニア達がヒヤヒヤしていた事情を解説します【ABEMAおよび各社エンジニアのみなさまお疲れさまでした】,"Dec 19, 2022",2829,10,206,1.46,0:01:32
F7JKRaKk4oY,ネットワーク業界関係者4000人が集まったJANOG55 in 京都 現地レポート【JANOG55前編】,"Mar 24, 2025",1714,10,601,0.5,0:00:23
7VQnQI0CaFA,【講演】インターネットの未来を予測するコツ【広島地域IPv6推進委員会】,"Apr 1, 2024",2540,10,546,0.92,0:13:43
hlsbpaUfqP0,地域ISPのネットワーク戦略に話を聞いてみました。,"Mar 3, 2019",1977,10,194,2.58,0:03:51
bNVJH3OCmVo,ネットワークは褒められにくい仕事！？ネットワークエンジニアのモチベーション維持の方法を考える,"Oct 14, 2024",1336,10,543,0.74,0:00:42
XkIwUUFgnbI,eSportsプロゲーマーの自宅回線トラブルをネットワークエンジニアが手伝って解決した話,"Sep 2, 2024",1726,10,437,1.14,0:04:44
fkbnXESrkLQ,ITエンジニア社長 ツッチーさんに起業したときの話を聞いてみた 【エンジニア対談】,"May 16, 2022",2448,10,144,0.69,0:01:23
utfaErKaMrs,シニアネットワークエンジニアが成長の伸び悩みについて本音を話してみた。,"Jul 4, 2022",1069,10,340,2.06,0:01:59
fHZpgFVRlNY,日本人が陥りがちな外国人エンジニアとのコミュニケーション失敗例,"Oct 31, 2022",2384,9,389,0.77,0:14:25
Ci0x3attzDo,ネットワーク業界最大規模のカンファレンス JANOG 50 in 函館 に現地参戦してきた,"Aug 30, 2022",2439,9,225,2.67,0:04:15
kDjkE_ASUXw,【あきみちさん対談】 ピアリング戦記の執筆の裏側・クラウドファンディング・技術書籍への企業スポンサーについて聞いてみた,"Sep 5, 2022",1919,9,654,0.76,0:11:15
59pn6YjA9JU,ネットワーク業界関係者 3200名が集まった JANOG54 in 奈良 を現地レポート【JANOG54前編】,"Aug 5, 2024",1623,9,404,1.98,0:00:23
HrKGwCduzns,海外転職を実現するための戦略について話してみました。,"Nov 22, 2021",1531,9,424,1.18,0:16:39
EFMTGgQEwTc,【ストレス爆発寸前！】子育てエンジニアのストレス・悩みを育児経験者にぶつけてみた,"Oct 17, 2022",1684,9,216,1.39,0:04:17
0-eGwE9h230,「やりたいこと」をするための時間の作り方,"Nov 16, 2020",1945,9,485,1.03,0:12:47
2lLeeAi0-l0,ネットワーク技術カンファレンス JANOG51 で議論された最新技術トレンドについて解説します,"Feb 27, 2023",2539,9,265,2.26,0:04:19
cGiowvDW758,衛星データ通信、コンテナ技術について話してみました。,"Apr 21, 2019",2757,8,456,1.32,0:00:08
xkWsJRMOetQ,光ケーブルをリモートから配線可能に!? ロボット自動光配線システム XENOpticsを体験してきた【show int x センコーアドバンス コラボ企画】,,1448,8,0,,0:05:21
1Ldlm3nDAAc,ローカル5G技術を利用した未来のゴルフ中継インターネットライブ配信システム【NEC】【JANOG53プログラム解説】,"May 27, 2024",1417,8,437,1.37,0:03:30
KMgdmbOt_C8,グローバル企業、入社前に感じていた５つの誤解,"Sep 6, 2021",2351,8,265,2.26,0:14:17
9lQ2n_IiXw4,ベテラン海外担当者が語る経験談「日本と海外のビジネス作法の違い」【前編】【show int x セイコーソリューションズ コラボ企画】,"May 26, 2025",2322,8,892,0.34,0:00:28
FkAUTYip1n8,トップレベルのエンジニアに求められるコミュニケーション力・リーダーシップ力,"Dec 13, 2022",1775,8,300,1.33,0:04:25
hB4CBLmK0lw,複数の会社から転職オファーをもらったときの選び方【視聴者さんからのお悩み相談】,"Nov 21, 2022",1222,8,230,3.04,0:01:08
zSU-VMfZtWI,「エンジニアも一度はマネージャーを経験した方が良い」という世間のアドバイスに対して真面目に議論してみた,"Nov 18, 2024",1612,8,532,0.38,0:00:57
CqSjyJWEkKk,ベテラン海外担当者が語る経験談「海外ビジネスを失敗させないための秘訣」【後編】【show int x セイコーソリューションズ コラボ企画】,"May 28, 2025",1747,8,788,0.38,0:02:24
jjEy_2RwBSo,JANOG54開催直前！show int の中の人が気になってる注目プログラム【2024年7月3-5日開催予定】,"Jun 17, 2024",4294,7,426,1.17,0:01:07
SMBdv4ryXEw,リモートワークの活力を上げる「朝散歩」の効果と方法,"Dec 14, 2020",1109,7,235,0.85,0:02:42
JXg_iQE7xe0,外資よりも国内企業が圧倒的に優れているポイント３選 【国内企業vs外資企業 比較】,"Oct 21, 2024",1567,7,462,0.43,0:05:49
NFNNBOflnkQ,【開催直前】JANOGスタッフがおすすめするJANOG51 Meeting みどころ紹介【最新技術から現地観光情報まで】,"Jan 9, 2023",3532,7,367,1.91,0:00:11
knFM1U8V-ug,エンジニアとして活躍するには「強みを伸ばすべき？」「弱みを無くすべき？」,"Jul 15, 2024",1124,7,530,0.57,0:03:36
XowRiqj8ar8,Googleが主導する気球ネットワーク「Project Loon」 を紹介します。,"Dec 21, 2020",1340,7,406,0,0:19:19
TFFpCss21sE,JANOG53 企業展示エリアを散策【JANOG53 in 博多 後編】,"Feb 13, 2024",1880,7,340,0.59,0:01:20
rGfOFxSwWoY,ネットワークエンジニアのキャリア観・人材像について話してみました。,"Jun 30, 2019",3242,7,223,2.69,0:07:04
qc9hZXIV_CM,ネットワークエンジニア社長の副業から起業までの話を聞いてみました。,"Apr 26, 2020",3004,6,189,1.06,0:06:23
fj5RNL6q5OE,JANOG54 in 奈良  企業展示エリアを現地レポート【JANOG54後編】,"Aug 12, 2024",2213,6,390,1.28,0:01:19
UbMKaR4VJjE,プログラマーがネットワークエンジニアとして活躍するための条件,"Sep 11, 2023",1598,6,370,1.35,0:05:43
giAgxweBc28,JANOG49ネットワークチームのみなさんにインタビューさせていただきました,"Feb 23, 2022",4260,6,163,0,0:01:34
tVl8msi-ztg,【JANOG52長崎 ②】ネットワーク企業145社が集まったJANOG52企業展示エリアを散策,"Aug 7, 2023",2218,6,325,1.85,0:02:46
SGJVDqkquT4,現役ネットワークエンジニアが実践する「モチベーションに頼らない成長戦略」,"Nov 7, 2022",1515,6,239,1.67,0:00:05
rc5uUq7gtwU,JANOG55 in 京都 終了直後！ 現地の様子を振り返ってみた,"Jan 27, 2025",2038,6,545,0.37,0:00:07
_FqlhXbzLMs,JANOG56 in 松江、 終了直後のホテルから現地の様子をふりかえってみた,"Aug 4, 2025",2134,6,893,0.45,0:00:52
8CscPvIiYPs,ネットワークエンジニアの「副業」や「起業」について話してみました。,"Oct 11, 2021",1282,6,199,1.51,0:03:55
vAq_6X10LBc,JANOG53開催直前! 注目プログラムを紹介します【2024年1月17-19日開催予定】,"Jan 8, 2024",1981,6,292,2.05,0:00:14
XgfZF9wPmPU,転職経験豊富なネットワークエンジニアにお話を聞いてみました。,"Jun 18, 2019",2178,6,225,2.67,0:01:21
VLPCOLVi1HY,自宅のインターネットが遅いときの改善方法,"May 15, 2023",1865,6,295,1.36,0:02:50
oWSua2XmuyY,新人エンジニアにおすすめしたい３つの習慣,"May 9, 2022",2651,5,231,1.3,0:11:09
mVgYA-M28Gg,有名VTuber の自宅インターネット回線トラブルを現役ネットワークエンジニアが助けてきた話,,2684,5,42,0,0:00:17
aHPVahiKu_E,開催直前！JANOG55 in 京都！ 注目プログラム紹介 【2025年1月22日(水)〜25日(金)】,"Jan 6, 2025",2642,5,625,0.16,0:00:38
RfyRP1vphW0,はじめてのリーダー職で自信が持てない人へのアドバイス【人生相談】【質問コーナー】,"Aug 18, 2025",1171,5,1007,0.2,0:04:38
gQJJM44a5mE,管理職を避け続けてきた現役エンジニアが自分のチームを立ち上げることになってしまった話,"Jul 14, 2025",1472,5,892,0.22,0:01:00
MDqkONWiu1k,Twitter・Facebookなどのグローバル企業で人員削減が相次いだ2022年。「大規模人員削減時代」にエンジニアがいま考えておくべきこと,"Dec 26, 2022",2482,5,214,1.4,0:09:19
_8LaXMVaHj0,大阪関西万博2025に行ってきました,"Jun 30, 2025",1582,5,732,0,0:00:58
bgChbVuCGjg,NTTドコモがネットワーク運用体制を刷新！SIer依存体制から脱却した話【JANOG50 プレゼン解説】,"Sep 20, 2022",1064,5,297,1.35,0:03:54
XKDZqChFT4I,JANOG52 in 長崎 みどころ紹介【7/5〜7/7開催予定】,"Jun 19, 2023",3860,5,235,0.85,0:00:23
7nwO7U6Ovlg,JANOG51終了直後！富士山からJANOG51現地の雰囲気をふりかえりました,"Jan 30, 2023",629,5,168,1.79,0:00:49
ytcuK826Fqc,開催直前！JANOG56 in 松江 の注目プログラムを紹介 【ネットワーク業界イベント】【カンファレンス】,"Jun 23, 2025",3618,5,785,0.51,0:10:43
UuVJhcAJm6s,【運営からのご報告】全ての動画内CMをやめることにしました,"Mar 27, 2023",580,5,184,0,0:00:59
mUTAN6xgGuQ,エンジニアとして専門性を尖らせるべきか、幅広くスキルを獲得するべきか,"Aug 15, 2022",1762,4,230,1.74,0:04:27
TgX16R6LMo8,JANOG54 in 奈良の終了直後！ 現地の様子を振り返ってみた,"Jul 8, 2024",1808,4,391,0.77,0:00:22
x332_QWLqII,副業のプロに聞く！副業に向いている人、副業に向いていない人,"Oct 2, 2023",1546,4,401,0.75,0:10:16
082qUR5jIfw,イケてるグローバル企業に転職するためにやるべきことについて語ってみました。,"Mar 1, 2021",3268,4,284,0.7,0:00:49
p_-OgJlU_xM,技術者コミュニティの立ち上げのコツ,"Jun 6, 2022",1851,4,198,2.02,0:08:01
0GoJgfSb5N8,JANOG53 Meeting in 博多 現地レポート【JANOG53 前編】,"Feb 5, 2024",1573,4,308,0.97,0:00:13
 -siFSub94lc,受講料無料のCCNA資格スクール 「ネットビジョンアカデミー」について聞いてみた,"Oct 30, 2020",3869,3,219,0.46,0:08:29
IK5NA-UHGW8,関西のネットワーク運用者コミュニティ NaniwaNOG 2 in 姫路 に参加してきた,"Dec 2, 2024",2054,3,485,0.41,0:02:46
Kv_EaxHzprk,【JANOG52長崎 ①】2000名のNW業界関係者が集結した JANOG52 in 長崎 を現地レポート,"Jul 31, 2023",1719,3,306,0.65,0:00:45
sjh2pPdGrJY,【1/26-28開催】JANOGスタッフがオススメするJANOG 49 みどころ紹介【show int x JANOG コラボ企画】,"Jan 11, 2022",2088,3,274,0.73,0:00:11
IgeDskcLp1E,JANOG53 in 博多 で面白かったプログラムを振り返ってみた,"Jan 22, 2024",1699,3,370,0.81,0:00:43
jItGDN06S_I,インターネットを24時間365日支える仕組みとは,"Feb 1, 2021",1630,3,140,1.43,0:00:16
vn_1gqEh8hw,show int の2022年振り返り & 2023年に挑戦したいこと,"Jan 16, 2023",1654,2,176,1.14,0:00:00
cnAvaMsiTLA,ネットワークエンジニアが自分の成長を実感するタイミング,"Jul 25, 2022",789,2,213,0.94,0:03:27
tm1PAROz8hQ,高校で必須化された新科目「情報I」について紹介します【JANOG51解説】,"Mar 20, 2023",1533,2,175,0,0:00:45
XC5J_Qbv7eE,ロシア・ウクライナ軍事侵攻によるインターネット分断の危機【スプリンターネット】【JANOG50プレゼン解説】,"Oct 3, 2022",2187,2,318,0.63,0:04:00
EfiPKBiaQDY,show int 応援企業に向けた報告会を開催しました,"Dec 31, 2023",2621,2,270,0.74,0:00:00
2cb-MUUDt3U,ゲームとインターネットの関係性について話してみました。,"Mar 9, 2019",1780,2,166,0.6,0:14:10
JH4JrdrO674,いい企業を見つける方法について話してみた,"Oct 11, 2022",1501,2,167,1.2,0:04:53
d5UTadczKcM,海外カンファレンス APNIC56 in 京都 に現地参加しました,"Feb 19, 2024",1110,2,277,0,0:00:11
_iisQcbn77M,エンジニアとして最高のチャンスを掴むためのスキル,"May 30, 2022",1502,1,190,0.53,0:00:09
T-6KBuF_ssg,JPNIC主催のセミナーイベント Internet Week 2024 開催直前！見どころ解説【11月19〜27日】【show int x JPNIC コラボ】,"Oct 28, 2024",2833,1,455,0,0:00:00
fkONgGhylsw,YouTube1000人突破記念！ 「show int がこれからやっていきたいこと」について語ってみました。,"May 3, 2021",1622,1,145,0,0:00:40
GCNZZ810pmk,JANOG52終了直後に現地の様子をふりかえる,"Jul 10, 2023",1234,1,230,0,0:00:01
3Fz8e-439Rg,エンジニアとして幸せな人生を実現するための方法について話してみた,"Aug 22, 2022",1529,1,224,0,0:04:39
dIREwHlIFyA,shwo int 2024年度前半の活動を応援企業と振り返ってみた,"Nov 4, 2024",3205,1,452,0,0:00:00
1qkS7INgVmg,リモートチームの作り方について話しました。,"Aug 3, 2020",3585,1,145,0,0:00:02
BgTWINTICd0,eSports時代に求められるネットワークの品質とは 【JANOG51解説】,"Mar 13, 2023",1863,1,196,0.51,0:34:39
GEicptmkEZg,技術についていけなくなる将来の不安に対するアドバイス,"Nov 6, 2023",1255,0,277,0,
mr0I8ynWtEM,show int のYouTubeチャンネル登録者の推移と統計情報で振り返ってみました。,"Apr 26, 2021",1257,0,205,0,
AG6wppYHXto,目の前の仕事を「やりたい仕事」に変換する方法,"Nov 23, 2020",906,0,196,0,
OmUCdRq0GmE,「YouTubeチャンネルをはじめたときの想い」について語ってみました。,"Apr 5, 2021",862,0,122,0,
_89lLsZoRgM,リモートワーク中のマネージャーとの1on1の重要性について話しました。,"Aug 4, 2020",2912,0,136,0,
evN-lfbttSA,【編集ミスのため非公開】最先端技術 & おもしろ技術ネタ が盛り沢山の JANOG55 企業展示ブースを現地レポート【JANOG55 後編】,"Mar 31, 2025",2658,0,0,,
hthEN8RHGSk,ポケモンGoとネットワーク交渉/Peering、ゲームについて話してみました。,"Nov 5, 2019",2485,0,146,0,
DS_XckbvoeM,日本中のネットワークエンジニアが集まる JANOG51 の会場から現場の雰囲気をレポートします,"Feb 6, 2023",2454,0,228,0,
WweuE-HpS_U,在宅勤務を楽しくできるリモートランチ雑談の効果とコツ,"Dec 28, 2020",1386,0,155,0,
